{
  "index_number": 199,
  "pp": 5,
  "max_pp": 8,
  "power": 0,
  "accuracy": 0,
  "category": "status",
  "priority": 0,
  "target": "target",
  "critical_hit": 0,
  "makes_contact": false,
  "affected_by_protect": true,
  "affected_by_magic_coat": false,
  "affected_by_snatch": false,
  "affected_by_mirror_move": false,
  "affected_by_kings_rock": false,
  "names": {
    "fr": "Verrouillage",
    "de": "Zielschuss",
    "gr": "Κλείδωμα Στόχου",
    "it": "Localizza",
    "en": "Lock-On"
  },
  "descriptions": {
    "en": "An attack that locks on to the target to ensure that the next attack will hit without fail."
  },
  "type": "Normal"
}