{
  "index_number": 240,
  "pp": 5,
  "max_pp": 8,
  "power": 0,
  "accuracy": 0,
  "category": "status",
  "priority": 0,
  "target": "everyone",
  "critical_hit": 0,
  "makes_contact": false,
  "affected_by_protect": false,
  "affected_by_magic_coat": false,
  "affected_by_snatch": false,
  "affected_by_mirror_move": false,
  "affected_by_kings_rock": false,
  "names": {
    "dk": "Regndans",
    "fr": "Danse Pluie",
    "de": "Regentanz",
    "gr": "Χορός Βροχής",
    "it": "Pioggiadanza",
    "pl": "Taniec Deszczu",
    "en": "Rain Dance"
  },
  "descriptions": {
    "en": "Summons rain for five turns. While it is raining, the power of Water-type moves increases."
  },
  "type": "Water"
}