{
  "index_number": 596,
  "pp": 10,
  "max_pp": 16,
  "power": 0,
  "accuracy": 0,
  "category": "status",
  "priority": 4,
  "target": "user",
  "critical_hit": 0,
  "makes_contact": false,
  "affected_by_protect": false,
  "affected_by_magic_coat": false,
  "affected_by_snatch": true,
  "affected_by_mirror_move": false,
  "affected_by_kings_rock": false,
  "names": {
    "fr": "Pico-DÃ©fense",
    "de": "Schutzstacheln",
    "it": "Agodifesa",
    "en": "Spiky Shield"
  },
  "descriptions": {
    "en": "In addition to protecting the user from attacks, this move also damages any attacker who makes direct contact."
  },
  "type": "Grass"
}