{
  "index_number": 292,
  "pp": 20,
  "max_pp": 32,
  "power": 15,
  "accuracy": 100,
  "category": "physical",
  "priority": 0,
  "target": "target",
  "critical_hit": 0,
  "makes_contact": true,
  "affected_by_protect": true,
  "affected_by_magic_coat": false,
  "affected_by_snatch": false,
  "affected_by_mirror_move": true,
  "affected_by_kings_rock": true,
  "names": {
    "fr": "Cogne",
    "de": "Armstoß",
    "gr": "Ώθηση Χειρός",
    "it": "Sberletese",
    "pl": "Siła Ramion",
    "en": "Arm Thrust"
  },
  "descriptions": {
    "en": "Straight-arm punches that strike the foe 2 to 5 times."
  },
  "type": "Fighting"
}