{
  "index_number": 282,
  "pp": 25,
  "max_pp": 40,
  "power": 65,
  "accuracy": 100,
  "category": "physical",
  "priority": 0,
  "target": "target",
  "critical_hit": 0,
  "makes_contact": true,
  "affected_by_protect": true,
  "affected_by_magic_coat": false,
  "affected_by_snatch": false,
  "affected_by_mirror_move": false,
  "affected_by_kings_rock": false,
  "names": {
    "fr": "Sabotage",
    "de": "Abschlag",
    "gr": "Τράνταγμα",
    "it": "Privazione",
    "pl": "Nokaut",
    "en": "Knock Off"
  },
  "descriptions": {
    "en": "Knocks down the foe’s held item to prevent its use."
  },
  "type": "Dark"
}