{
  "index_number": 264,
  "pp": 20,
  "max_pp": 32,
  "power": 150,
  "accuracy": 100,
  "category": "physical",
  "priority": -3,
  "target": "target",
  "critical_hit": 0,
  "makes_contact": true,
  "affected_by_protect": true,
  "affected_by_magic_coat": false,
  "affected_by_snatch": false,
  "affected_by_mirror_move": false,
  "affected_by_kings_rock": false,
  "names": {
    "fr": "Mitra-Poing",
    "de": "Power-Punch",
    "gr": "Εστιασμένη Γροθιά",
    "it": "Centripugno",
    "pl": "Centrocios",
    "en": "Focus Punch"
  },
  "descriptions": {
    "en": "A powerful loyalty attack. The user flinches if hit.*Powerful, but makes the user flinch if hit by foe.*"
  },
  "type": "Fighting"
}