{
  "index_number": 191,
  "pp": 20,
  "max_pp": 32,
  "power": 0,
  "accuracy": 0,
  "category": "status",
  "priority": 0,
  "target": "all_foes",
  "critical_hit": 0,
  "makes_contact": false,
  "affected_by_protect": false,
  "affected_by_magic_coat": false,
  "affected_by_snatch": false,
  "affected_by_mirror_move": false,
  "affected_by_kings_rock": false,
  "names": {
    "fr": "Picots",
    "de": "Stachler",
    "gr": "Καρφιά",
    "it": "Punte",
    "pl": "Kolce",
    "en": "Spikes"
  },
  "descriptions": {
    "en": "An attack that scatters Spikes and injures opponent Pokémon when they switch."
  },
  "type": "Ground"
}