{
  "index_number": 288,
  "pp": 5,
  "max_pp": 8,
  "power": 0,
  "accuracy": 0,
  "category": "status",
  "priority": 0,
  "target": "user",
  "critical_hit": 0,
  "makes_contact": false,
  "affected_by_protect": false,
  "affected_by_magic_coat": false,
  "affected_by_snatch": false,
  "affected_by_mirror_move": false,
  "affected_by_kings_rock": false,
  "names": {
    "fr": "Rancune",
    "de": "Nachspiel",
    "gr": "Κατάρα",
    "it": "Rancore",
    "en": "Grudge"
  },
  "descriptions": {
    "en": "If the user faints, deletes the PP of the final move."
  },
  "type": "Ghost"
}