{
  "index_number": 497,
  "pp": 15,
  "max_pp": 24,
  "power": 40,
  "accuracy": 100,
  "category": "special",
  "priority": 0,
  "target": "target",
  "critical_hit": 0,
  "makes_contact": false,
  "affected_by_protect": true,
  "affected_by_magic_coat": false,
  "affected_by_snatch": false,
  "affected_by_mirror_move": false,
  "affected_by_kings_rock": true,
  "names": {
    "fr": "Ã‰cho",
    "de": "Widerhall",
    "it": "Echeggiavoce",
    "en": "Echoed Voice"
  },
  "descriptions": {
    "en": "The user attacks the target with an echoing voice. If this move is used every turn, it does greater damage."
  },
  "type": "Normal"
}