{
  "index_number": 86,
  "pp": 20,
  "max_pp": 32,
  "power": 0,
  "accuracy": 100,
  "category": "status",
  "priority": 0,
  "target": "target",
  "critical_hit": 0,
  "makes_contact": false,
  "affected_by_protect": true,
  "affected_by_magic_coat": false,
  "affected_by_snatch": false,
  "affected_by_mirror_move": false,
  "affected_by_kings_rock": false,
  "names": {
    "dk": "Tordenbølge",
    "fr": "Cage-Éclair",
    "de": "Donnerwelle",
    "gr": "Κύμα Ηλεκτρομαγνητισμού",
    "it": "Tuononda",
    "pl": "Fala Grzmotu",
    "tr": "Yıldırım Dalgası",
    "en": "Thunder Wave"
  },
  "descriptions": {
    "en": "A special move that causes paralysis. When paralyzed, the victim has a one-in-four chance of immobility."
  },
  "type": "Electric"
}