{
  "index_number": 250,
  "pp": 15,
  "max_pp": 24,
  "power": 35,
  "accuracy": 85,
  "category": "special",
  "priority": 0,
  "target": "target",
  "critical_hit": 0,
  "makes_contact": false,
  "affected_by_protect": true,
  "affected_by_magic_coat": false,
  "affected_by_snatch": false,
  "affected_by_mirror_move": false,
  "affected_by_kings_rock": true,
  "names": {
    "fr": "Siphon",
    "de": "Whirlpool",
    "gr": "Δίνη",
    "it": "Mulinello",
    "pl": "Wir Wodny",
    "en": "Whirlpool"
  },
  "descriptions": {
    "en": "Lasts two to five turns. Foe becomes trapped in a vortex, making it impossible to switch."
  },
  "type": "Water"
}