{
  "index_number": 528,
  "pp": 15,
  "max_pp": 24,
  "power": 90,
  "accuracy": 100,
  "category": "physical",
  "priority": 0,
  "target": "target",
  "critical_hit": 0,
  "makes_contact": true,
  "affected_by_protect": true,
  "affected_by_magic_coat": false,
  "affected_by_snatch": false,
  "affected_by_mirror_move": false,
  "affected_by_kings_rock": true,
  "names": {
    "fr": "Éclair Fou",
    "de": "Stromstoß",
    "it": "Sprizzalampo",
    "pl": "Dzika Energia",
    "en": "Wild Charge"
  },
  "descriptions": {
    "en": "The user shrouds itself in electricity and smashes into its target. It also damages the user a little."
  },
  "type": "Electric"
}