{
  "index_number": 571,
  "pp": 20,
  "max_pp": 32,
  "power": 0,
  "accuracy": 100,
  "category": "status",
  "priority": 0,
  "target": "target",
  "critical_hit": 0,
  "makes_contact": false,
  "affected_by_protect": true,
  "affected_by_magic_coat": false,
  "affected_by_snatch": false,
  "affected_by_mirror_move": false,
  "affected_by_kings_rock": false,
  "names": {
    "fr": "Mal√©fice Sylvain",
    "de": "Waldesfluch",
    "it": "Boscomalocchio",
    "en": "Forest's Curse"
  },
  "descriptions": {
    "en": "The user puts a forest curse on the target. Afflicted targets are now Grass type as well."
  },
  "type": "Grass"
}