{
  "index_number": 475,
  "pp": 15,
  "max_pp": 24,
  "power": 0,
  "accuracy": 0,
  "category": "status",
  "priority": 0,
  "target": "user",
  "critical_hit": 0,
  "makes_contact": false,
  "affected_by_protect": false,
  "affected_by_magic_coat": false,
  "affected_by_snatch": true,
  "affected_by_mirror_move": false,
  "affected_by_kings_rock": false,
  "names": {
    "fr": "All√®gement",
    "de": "Autotomie",
    "it": "Sganciapesi",
    "en": "Autotomize"
  },
  "descriptions": {
    "en": "The user sheds part of its body to make itself lighter and sharply raise its Speed stat."
  },
  "type": "Steel"
}