{
  "index_number": 308,
  "pp": 5,
  "max_pp": 8,
  "power": 150,
  "accuracy": 90,
  "category": "special",
  "priority": 0,
  "target": "target",
  "critical_hit": 0,
  "makes_contact": false,
  "affected_by_protect": true,
  "affected_by_magic_coat": false,
  "affected_by_snatch": false,
  "affected_by_mirror_move": false,
  "affected_by_kings_rock": true,
  "names": {
    "fr": "Hydroblast",
    "de": "Aquahaubitze",
    "gr": "Υδραυλικό Ολμοβόλο",
    "it": "Idrocannone",
    "pl": "Hydrodziało",
    "en": "Hydro Cannon"
  },
  "descriptions": {
    "en": "Powerful, but leaves the user immobile the next turn."
  },
  "type": "Water"
}