{
  "index_number": 566,
  "pp": 10,
  "max_pp": 16,
  "power": 90,
  "accuracy": 100,
  "category": "physical",
  "priority": 0,
  "target": "target",
  "critical_hit": 0,
  "makes_contact": true,
  "affected_by_protect": false,
  "affected_by_magic_coat": false,
  "affected_by_snatch": false,
  "affected_by_mirror_move": false,
  "affected_by_kings_rock": true,
  "names": {
    "fr": "Hantise",
    "de": "Phantomkraft",
    "it": "Spettrotuffo",
    "en": "Phantom Force"
  },
  "descriptions": {
    "en": "The user vanishes somewhere, then strikes the target on the next turn. This move hits even if the target protects itself."
  },
  "type": "Ghost"
}