{
  "index_number": 194,
  "pp": 5,
  "max_pp": 8,
  "power": 0,
  "accuracy": 0,
  "category": "status",
  "priority": 0,
  "target": "user",
  "critical_hit": 0,
  "makes_contact": false,
  "affected_by_protect": false,
  "affected_by_magic_coat": false,
  "affected_by_snatch": false,
  "affected_by_mirror_move": false,
  "affected_by_kings_rock": false,
  "names": {
    "fr": "Prélèvem. Destin",
    "de": "Abgangsbund",
    "gr": "Κοινό Πεπρωμένο",
    "it": "Destinobbligato",
    "en": "Destiny Bond"
  },
  "descriptions": {
    "en": "A move that causes the opponent to faint if the user faints after using this move."
  },
  "type": "Ghost"
}