{
  "index_number": 317,
  "pp": 15,
  "max_pp": 24,
  "power": 60,
  "accuracy": 95,
  "category": "physical",
  "priority": 0,
  "target": "target",
  "critical_hit": 0,
  "makes_contact": false,
  "affected_by_protect": true,
  "affected_by_magic_coat": false,
  "affected_by_snatch": false,
  "affected_by_mirror_move": false,
  "affected_by_kings_rock": false,
  "names": {
    "fr": "Tomberoche",
    "de": "Felsgrab",
    "gr": "Ταφόπλακα",
    "it": "Rocciotomba",
    "pl": "Kamienny Grób",
    "en": "Rock Tomb"
  },
  "descriptions": {
    "en": "Stops the foe from moving with rocks and cuts Speed.*Stops the foe from moving with rocks. May lower Speed.*"
  },
  "type": "Rock"
}